Titulo;Seccion;Contenido;link
"
Argentina arrasó en los Oscar del deporte con un doblete histórico: Lionel Messi y la Scaloneta, los mejores del año en los Premios Laureus
";Deportes;"
Lionel Messi es mejor deportista de 2023. Es mejor que que el futbolista francés Kylian Mbappé -aunque en PSG piensen increíblemente lo contrario-. También es mejor que el piloto neerlandés Max Verstappen, el atleta sueco Mondo Duplantis, el tenista español Rafael Nadal y el basquetbolista estadounidense Stephen Curry. Así lo definió el jurado de notables de los Premios Laureus, los Oscar del deporte, que se entregaron este lunes en el Pavillion Vendome de París.



Pero las conquistas de Messi, en tiempos de turbulencias en su club y con su futuro atrapado entre signos de interrogación, no se terminaron allí. Es que la Selección Argentina, esa que tiene como capitán al rosarino y que viene de alzar la Copa del Mundo en Qatar 2022, es el mejor equipo de año. Es mejor que el seleccionado femenino de fútbol de Inglaterra, el seleccionado masculino de rugby de Francia, el equipo de fútbol de Real Madrid, los Golden State Warriors de la NBA y la escudería Red Bull de Fórmula 1. Sí, Messi y la Scaloneta son los mejores entre los mejores. Y poco hay para discutir. 
Es la segunda vez que Messi, de 35 años, gana un Laureus después del que obtuvo en 2020. Sin embargo, en aquella ocasión, la Pulga compartió el reconocimiento con el piloto británico de Fórmula 1 Lewis Hamilton. Esta vez fue en solitario y le tocó suceder a Verstappen, vencedor en 2022. Sin embargo, está lejos de las cinco estatuillas que acopió el suizo Roger Federer en su maravillosa carrera como tenista.
""El Mundial llegó al final de mi carrera, pero fue lo más lindo"", manifestó Messi, quien estuvo acompañado en el escenario por la leyenda del rugby argentino Hugo Porta, quien comparó al capitán de la Selección Argentina con el estadista sudafricano Nelson Mandela por su liderazgo y por su capacidad de inspirar a los demás. ""Si estuviera Mandela acá te daría un abrazo"", enfatizó el ex apertura de Los Pumas.
""Me costó muchísimo (el Mundial), casi toda mi carrera. Lo quiero compartir con toda Argentina"", siguió Messi, visiblemente emocionado. En ese momento, recordó que antes había tenido ""muchísimas alegrías con el Barcelona y tristezas con la Selección"". Y cerró: ""Fue una enseñanza, con muchas piedras en el camino, para superarme, superarse, junto a mi familia y mis seres queridos"", agregó, quien asistió a la velada junto a su pareja, Antonela Roccuzzo. Juntos causaron furor con sus looks.







Pero la noche de Messi no culminó allí. Es que Leo hizo historia y no necesitó tener una pelota como herramienta. Ni siquiera tuvo que ponerse los cortos. Con su elegante esmoquin se convirtió en el primer deportista que fue doblemente premiado en los Laureus (individualmente y por equipos) desde que comenzaron a entregarse estos galardones, en 2000. Es que la Selección Argentina también se llevó su estatuilla y fue Messi el que lo recibió. Y eso que también participaron de la fiesta el presidente de la AFA, Claudio Chiqui Tapia. y el defensor Lisandro Martínez, que estuvo acompañado por su pareja, la influencer Muri López Benítez.
La Scaloneta, esa magnífica e inolvidable creación de Lionel Scaloni, se llevó el premio por su papel en el Mundial de Qatar, donde se impuso en una final-thriller ante Francia, segundo en discordia, luego de la definición por penales para gritar campeón por tercera vez en la historia. Un detalle no menor: Messi se fue de la gala con un pin en una de sus solapas con el escudo de la AFA y sus flamantes tres estrellas. 
La Selección sucede a la selección de fútbol de Italia, a la que el año pasado le dio un baile inolvidable en Wembley en la Finalissima, esa sonrisa que sirvió como prólogo de ese fin de año inolvidable en Medio Oriente. ""Fue un premio al trabajo, al compañerismo, a la humildad y al respeto. No solo Argentina se sintió identificada (con nuestro equipo), sino gran parte del mundo. Respeto ante todo"", declaró Messi, quien recibió el premio de las manos del entrenador italiano Fabio Capello y del futbolista español Carles Puyol, su ex compañero de andadas en el Barcelona, que al igual que Porta integran el jurado de 71 notables de la Academia Laureus.
""La hemos peleado y hemos pasado momentos muy difíciles, pero todos juntos, con esa fuerza, esa hambre, nos dijimos: ¿por qué no podemos ser campeones del mundo? Después del partido contra Arabia Saudita, como dijo Leo, había que creer"", comentó Licha Martínez, que se recuperá de una lesión en uno de sus pies. Y agregó: ""Lo hicimos con humildad de aceptar la derrota, respetando a los rivales cuando ganamos y perdemos"".







También tuvo la palabra Chiqui Tapia, quien aseguró que el triunfo en Qatar supuso ""una gran alegría para todos los argentinos que se sintieron orgullosos de su país en un momento muy especial"". Y cerró: ""Cuando hay un proyecto y todo un equipo quiere lo mismo no hay imposibles"", cerró el hombre fuerte del fútbol argentino que está de viaje por Europa por asuntos comerciales.
Fue otra noche argentina en París, con un Messi que volvió a brillar luego de una semana convulsionada por su viaje a Arabia Saudita que desembocó en una inaudita sanción de la dirigencia de PSG. Horas antes de convertirse en el centro del universo del deporte, la Pulga al menos había conseguido el indulto de sus patrones qataríes y pudo entrenarse en el Camp des Loges, el predio deportivo de su club. Fue el mismo día en que en España aseguraron, sin asidero alguno, que su futuro estaba atado al Al Hilal, el equipo árabe que dirige Ramón Díaz. Por ahora, nada está resuelto. Sólo se sabe que Messi y la Scaloneta son los mejores entre los mejores.
Los otros premiados









Carlos Alcaraz, la revelación del año. 


Un día más tarde de levantar el Masters 1.000 de Madrid, Carlos Alcaraz, de 20 años, recibió el Laureus como el deportista revelación de 2023. Pesó su conquista del Abierto de Estados Unidos en septiembre del pasado año y haber sido el número uno mundial masculino más joven de la historia. El portugués Luis Figo fue quien le entregó la estatuilla al joven murciano, a quien se lo vio mantener una divertida charla con Messi.
Como mejor deportista femenina de 2022, sorprendió la atleta jamaiquina Shelly-Ann Fraser-Pryce, de 36 años, quien se impuso a la futbolista española Alexia Putellas, la nadadora estadounidense Katie Ledecky y la tenista polaca Iga Swiatek, entre otras.
El futbolista danés Christian Eriksen, de 31 años, ganó el premio a la mejor regreso del año, después de recuperarse de un paro cardíaco en junio de 2021, en pleno partido de la Eurocopa ante Finlandia.









Christian Eriksen, regreso del año. Foto: EFE 


Las otras categorías recayeron en la suiza Catherine Debrunner, como mejor atleta paralímpica; y la esquiadora estadounidense Eileen Gu, como mejor deportista extrema. Finalmente, el futbolista polaco Robert Lewandowski entregó el galardón de la categoría ""Sport for Good"" a la iniciativa TeamUp, una asociación entre Save the Children, Unicef de los Países Bajos y War Child, que se puso en marcha en 2022 en Polonia con los niños ucranianos refugiados por culpa de la invasión rusa.



Mirá también






Conmoción en el atletismo: Tori Bowie, la triple medallista olímpica hallada muerte, estaba embarazada de siete meses








Final del castigo para Lionel Messi, que volvió a entrenarse con París Saint Germain



";https://www.clarin.com/deportes/argentina-arraso-oscar-deporte-doblete-historico-lionel-messi-scaloneta-mejores-ano-premios-laureus_0_EJEfQpUjkO.html
"
El divertido reencuentro entre Lionel Messi y Lewandowski tras el cruce en el Mundial de Qatar
";Deportes;"
En la mayoría de los casos, no hay enojos deportivos que una charla no puedan subsanar. Este lunes, en los premios Laureus, podría haber quedado zanjado un cruce con historia. ¿Los protagonistas? Ni más ni menos que Lionel Messi, el capitán de la Selección Argentina, y el goleador polaco Robert Lewandowski, quienes compartieron un ameno diálogo en medio de la alfombra roja montada en el lujoso Pavillon Vendome, en el centro de París.





Según pudo saber Clarín, Lewandowski fue quien esperó al rosarino de 35 años en uno de los 'laberintos' que recorrían los invitados a la gala. El delantero del Barcelona, estuvo invitado porque entregó a la iniciativa ""TeamUp"" el galardón de la categoría ""Sport for Good"" de los Oscars del deporte.
El polaco fue paciente mientras Messi caminaba de la mano de su esposa Antonela Roccuzzo, quien también participó de la divertida charla, un tono muy distinto al de aquellos momentos de cruces de declaraciones entre ambos referentes de sus seleccionados.


En el diálogo, de aproximadamente un minuto, Messi le preguntó si estaba viviendo junto a su familia en Casteldefels y Antonela le comentó que tanto el delantero polaco como su mujer ""amaban"" la ciudad de Barcelona.
Un cruce con historia 









Foto: Kirill KUDRYAVTSEV / AFP. 


La bronca se había generado hace más de un año y medio, tras la postergada entrega post pandemia por Covid del Balón de Oro 2021.
Lewandowski creía que iba a ser para él ya que había tenido una temporada perfecta con Bayern Munich y había marcado 40 goles. Pero no.
Ese premio finalmente se lo llevó Messi conquistando su séptimo galardón personal porque tuvo una gran temporada en Barcelona y conquistó junto a la Selección la Copa América en Brasil, relegando al polaco al segundo lugar, por sólo 33 votos.
El resultado desató la furia del polaco. Lo curioso, es que en la propia gala de premiación, fue el propio Messi el que le tiró buena onda a Lewandowski: ""Es un honor pelear con Lewandowski, fuiste el ganador del Balón de Oro del año pasado (por el 2020 que no se entregó por la pandemia) y France Football te debería dar el premio. tendrías que tenerlo en casa también"".
Lewandowski no creyó en el mensaje mandado por Leo durante la ceremonia y contratacó: ""Quisiera que sea una declaración sincera de un gran jugador y no palabras vacías"", dijo con bastante mal humor.







El nuevo capítulo tuvo lugar en enero de 2022 con el premio The Best que otorga la FIFA. Y esta vez fue para Lewandowski quien volvió a traer a Messi al centro de la escena.
""Llegué a la conclusión de que el premio FIFA es más importante, porque el Balón de Oro sólo votan los periodistas. En cambio, en este trofeo votan los profesionales del fútbol, los capitanes y entrenadores, que pueden evaluar todo de una forma más realista"", dijo el polaco bajándole el precio al Balón de Oro que otorgan los franceses.
El polaco, por su parte, se mostró molesto cuando le preguntaron por Messi a su arribo a Qatar.
""Se están malinterpretando las cosas. Nunca dije que las palabras de Messi no habían sido sinceras. Lo que dijo de mí en París me conmovió y me hizo feliz de verdad. Lo felicito por el premio"", dijo Lewandowski. Sin embargo, nadie le creyó.







El 1 de diciembre pasado, durante el tercer partido de la fase de grupos del Mundial de Qatar que Argentina le ganó a Polonia, se volvieron a cruzar. Durante el segundo tiempo, el polaco le hizo una falta a Messi en mitad de cancha y la Pulga le mostró total indiferencia ante el pedido de disculpas por la acción del delantero.
""Llegué a cruzarme con Messi y fue muy raro porque estábamos los dos en el centro del campo. Estaba defendiendo en el medio juego y yo sabía que tenía que ayudar al equipo"", aseguró Lewandowski sobre la infracción y el hecho de que ambos se encontraran protagonizando una falta en mitad de cancha.
En la zona mixta, Leo Messi le restó importancia a lo que pasó con la estrella de Polonia: ""No pasa nada, nada. Él no habla español y a mí me enseñaron que todo lo que se habla en la cancha queda en la cancha y el vestuario"", dijo.
A pesar de que no hablan el mismo idioma, post partido se vio a Lewandowski y a Leo charlando a un costado de la cancha, con la boca tapada con las manos. ""Messi y yo hablamos un poco -admitió Lewandowski-. Fue divertido. Le dije a Messi que estaba jugando más defensivo que de costumbre, pero que a veces eso es lo que necesita el equipo"", señaló Lewandowski, en declaraciones al diario Bild de Alemania.











Mirá también






Argentina arrasó en los Oscar del deporte con un doblete histórico: Lionel Messi y la Scaloneta, los mejores del año en los Premios Laureus








Alexis Mac Allister, de ""chiripa"", hizo el gol del honor en la durísima derrota de Brighton ante el renacido Everton








La entrega de los Premios Laureus 2023, EN VIVO: Lionel Messi fue elegido el mejor deportista y la Selección Argentina es el mejor equipo








Lionel Messi y dos noticias fuertes en un lunes de premios: el indulto de PSG y un rumor sin asidero sobre su futuro








Final del castigo para Lionel Messi, que volvió a entrenarse con París Saint Germain








Conmoción en el atletismo: Tori Bowie, la triple medallista olímpica hallada muerte, estaba embarazada de siete meses



";https://www.clarin.com/deportes/divertido-reencuentro-lionel-messi-lewandowski-cruce-mundial-qatar_0_u3aARCiDP2.html
