Titulo;Seccion;Contenido;link
"
Ciudad: la inflación fue del 7,8% por la disparada de los precios de los alimentos
";Economía;"
Por la disparada de los precios de los alimentos (+10,4%), durante abril el Índice de Precios al Consumidor de la Ciudad de Buenos Aires (IPCBA) registró un incremento del 7,8%, acumulando en los primeros cuatro meses del año una suba de 31,2%, con los alimentos con una suba del 37,7%. El 7,8% registrado en abril es el más alto en 11 años.



La inflación interanual aumentó 3,9 puntos en relación a marzo, ubicándose en el 110,4%, de acuerdo a los datos de la Dirección de Estadística y Censos porteña.
Por la importancia de la Capital Federal, estos datos anticipan las cifras de inflación que el próximo viernes 12 debe difundir el INDEC. Las estimaciones privadas calculan un alza del 7,5%.
La inflación en CABA del 7,8%  supera la medición de marzo que fue del 7,1%, lo que indica una aceleración de la suba de los precios.
Si se excluyen los precios de los productos estacionales y regulados, la inflación núcleo - o sea no sujeta a la intervención del Estado ni por razones de estación -- fue más alta, del 8,1%, lo que marca que los precios libres superaron al promedio del mes. 
En tanto, por los aumentos autorizados para mayo, como combustibles, prepagas, transporte, alquileres, se descuenta que la inflación de este mes tendrá un piso del 7%, según las estimaciones de las consultoras privadas.
El alza en Alimentos y bebidas no alcohólicas -el rubro que registró en abril el mayor porcentaje de incremento y que es el de mayor incidencia en la medición- provino de verduras y legumbres (19,9%) seguido de Carnes y derivados (11,5%). En menor medida, se destacaron los aumentos en Leche, productos lácteos y huevos (10,8%) y Pan y cereales (8,5%).
Con estas cifras, los precios de los alimentos acumulan un alza del 37,7% en apenas 4 meses, liderado por las verduras (54,4%), carnes ( 51,7%) y frutas (49,2%). Y del 119,5% en relación a un año atrás.  Ni los salarios ni las jubilaciones y pensiones y demás prestaciones sociales tuvieron aumentos de esta magnitud. 
Estos valores golpean más a los sectores de menores recursos que destinan una proporción mayor de sus magros ingresos a alimentarse, anticipando un incremento de la indigencia y de la pobreza ya que la línea familiar de pobreza ( matrimonio con 2 hijos menores)  rondaría los $ 210.000 mensuales  sin computar el alquiler. Con un alquiler modesto supera fácilmente los $ 270.000. 
En el resto de los sectores los aumentos también fueron significativos: 
  Vivienda, agua, electricidad, gas y otros combustibles aumentó 6,4%, al impactar principalmente las subas en los precios de los alquileres. Le siguieron en importancia, los incrementos en la tarifa residencial del servicio de electricidad.
Restaurantes y hoteles promedió un alza de 8,2%, como resultado de los aumentos en los precios de los alimentos preparados en restaurantes, bares y casas de comida. En 12 meses acumula un alza del 130.9%.
Transporte registró una suba de 8,1% debido a los incrementos en los valores de los pasajes aéreos, de los combustibles y lubricantes para vehículos de uso del hogar y de los automóviles.
Equipamiento y mantenimiento del hogar aumentó 9,3%, al impactar los ajustes en las remuneraciones del personal de servicio doméstico. Le siguieron en importancia, las alzas en los valores de los grandes electrodomésticos y de los productos de limpieza.
 Prendas de vestir y calzado promedió una suba de 9,4%., como resultado del comportamiento estacional de la división. Este rubro acumula un incremento interanual del 117,7%. 
El Informe porteño señala que “durante la variación del IPCBA respondió fundamentalmente a las subas en las siguientes divisiones: Alimentos y bebidas no alcohólicas, Vivienda, agua, electricidad, gas y otros combustibles, Restaurantes y hoteles, Transporte, Equipamiento y mantenimiento del hogar y Prendas de vestir y calzado, que en conjunto explicaron el 75,7% del alza del Nivel General.”.
Y términos interanuales, “las divisiones Alimentos y bebidas no alcohólicas, Vivienda, agua, electricidad, gas y otros combustibles y Restaurantes y hoteles, fueron las principales responsables del incremento de los precios minoristas, explicando el 49,4% de la variación interanual del Nivel General.”



Mirá también






El FMI dice que sigue negociando, pero todavía no hay señales del desembolso de los US$ 10.000 millones



";https://www.clarin.com/economia/ciudad-inflacion-7-8-disparada-precios-alimentos_0_9SlHUljJ2G.html
"
Trump candidato: tensión en los medios de EE.UU.
";Opinión;"

Donald Trump se perfila otra vez como candidato a presidente de los Estados Unidos por el Partido Republicano para las elecciones de 2024, y el dato ha tensionado al sistema de medios de ese país, que se hace una pregunta inédita: cómo actuar.



El interrogante no es caprichoso. Para una parte importante del periodismo y los ciudadanos, los medios de comunicación fueron “culpables” del éxito electoral de Trump. Lo escribió el pasado marzo Martin Baron, ex editor jefe de The Washington Post: “Muchos periodistas llegaron a la conclusión de que nuestra profesión fracasó en cumplir su responsabilidad en un momento histórico peligroso. Su prueba, en primer lugar, es que Trump fue elegido; y que todavía mantiene un fuerte control sobre los republicanos y gran parte de los estadounidenses”.
Una entrevista al ex presidente en la CNN -programada para mañana miércoles en horario central nocturno- es asumida como el comienzo de la nueva campaña electoral, y se la señala como una pieza clave para pensar cuál será el rol que deberían llevar adelante los medios de cara a la próxima elección.
La edición digital para Estados Unidos del diario inglés The Guardian, de creciente audiencia entre una parte de los norteamericanos, críticos de sus diarios de cabecera por su pregonada neutralidad, no dudó en adjetivar la decisión de CNN de ofrecer ese espacio estelar al ex presidente: “Dice ser la cadena de noticias más fiable. Pero el miércoles dedicará una hora de su horario central a un mentiroso en serie que intentó terminar con la democracia estadounidense”, escribió el periodista David Smith.
Pero, ¿qué es exactamente lo que se cuestiona en la cobertura de Trump? Una primera respuesta se encuentra en la nota (tapa de la revista dominical) publicada el último domingo por la columnista Margaret Sullivan en el Post de la capital norteamericana. “Si Trump vuelve a presentarse, no lo cubras igual: manifiesto de un periodista”, tituló su artículo.
En el texto, entre otras cosas, plantea una autocrítica: “Demasiadas veces hemos actuado como sus taquígrafos o megáfonos (...) Tardamos demasiado en moderar nuestro instinto de dar la misma importancia a ambas partes, incluso cuando una de ellas utilizaba la desinformación en beneficio político"".
Y avanza en la descripción de un tiempo, para ella, dramático: “La democracia estadounidense se encuentra al borde del precipicio. ¿Qué puede hacer la prensa para evitar que caiga en vísperas de la elección 2024?”.
Su respuesta a dicha pregunta es disruptiva: “... (la presidencia de Trump) ha sido una educación para nosotros, una comprensión gradual de que los instintos y las convenciones del periodismo tradicional no eran lo suficientemente buenos para este momento de la historia de nuestro país (…) ahora que Trump se prepara para presentarse de nuevo en 2024 merece la pena recordar que cuando se informa sobre políticos que van esencialmente en contra de la democracia, el periodismo de viejo estilo ya no es suficiente”.
Y avanza: “Estoy convencida de que los periodistas deben centrarse en la búsqueda de la verdad, no en la neutralidad al estilo clásico”.
La definición no es menor porque cuestiona un paradigma de más de un siglo, constitutivo de la principal democracia del mundo.
“Es mucho lo que está en juego. Hacer las cosas como siempre no es ni remotamente apropiado”, desafía Sullivan.
La influencia de lo que allí ocurra de ahora en adelante invita a seguirlo con atención.




";https://www.clarin.com/opinion/trump-candidato-tension-medios-ee-uu-_0_qHZEEHJoiw.html
"
La Justicia argentina dio el visto bueno para que el avión venezolano-iraní que está retenido en Ezeiza sea decomisado hacia Estados Unidos
";Política;"
Con una decisión de varias aristas la Cámara Federal de La Plata confirmó este lunes a la noche los fallos del juez federal de Lomas de Zamora Federico Villena en relación a la tripulación del avión venezolano de Emtrasur que permanece retenido en Ezeiza desde junio de 2022 y sobre la aeronave consideró que el planteo de nulidad sobre el secuestro de la misma solicitado por los abogados que representan al régimen chavista, devenía en “abstracto”.



Ello liberó entonces la suerte del Boeing de Emtrasur que perteneció a la iraní Mahan Air y sobre el que pesan sanciones en Estados Unidos, a la justicia estadounidense que ya pidió recientemente su decomiso, tal como anticipó Clarín.
El decomiso, es decir el envío en este caso de la aeronave que está siendo mantenida por alguaciles especiales de los Estados Unidos, implica que en los próximos días la aeronave debería volar hacia ese país, porque en la Argentina ya habría sido liberada.
Igualmente, el Ministerio de Justicia es el encargado de transmitir este pedido a Villena, que ya no tiene causa judicial sobre la aeronave.
Entre tanto, la Cámara Federal también dictaminó este lunes la decisión de Villena de sobreseer a 14 tripulantes de la aeronave y de dictar falta de mérito sobre otros cinco. Toda la tripulación, no obstante, salió del país sobre fines de año, después de permanecer meses retenida.
Al levantar las cautelares sobre el avión y dejarlo bajo la decisión de la justicia estadounidense, la Cámara Federal dijo que ""teniendo en cuenta lo resuelto en el día de la fecha en el marco del legajo FLP 26547/2022/14/CA9, en cuanto se confirmó el levantamiento de la medida cautelar que pesaba sobre la aeronave Boeing 747-300, matrícula YV-3531, no se advierte, en el caso, que el peticionante tenga un interés legítimo sobre la investigación"". Y con el rechazo a los planteos, dio el visto bueno para que el avión deje finalmente el país.
Asimismo, la Cámara Federal no hizo lugar a algunos de los pedidos de la DAIA y su abogada Marta Nercellas sobre los venezolanos e iraníes que estaban siendo investigados con el objetivo de determinar si algunos de los tripulantes -en particular el piloto Gholamreza Ghasemi- tenía vínculos y pertenencia a grupos considerados terroristas por Estados Unidos -como la Fuerza Quds del Cuerpo de la Guardia Revolucionaria Iraní (IRGC-QF) y Hezbollah-. Pero sigue considerando a la entidad como organización con personería jurídica para futuras investigaciones.
El pedido de decomiso de Estados Unidos
Hace cuatro días, otro fallo, esa vez en Estados Unidos. había dado el primer paso para el principio del fin de la novela del avión venezolano-iraní retenido en el aeropuerto internacional de Ezeiza desde junio pasado. 
Fue el juez federal Randolph Moss, del distrito de Columbia, quien definió el decomiso de la aeronave de la aerolínea estatal venezolana Emtrasur, que antes fuera propiedad de otra iraní, ambas firmas bajo sanciones internacionales.
El dictamen se dio en el marco de un pedido de embargo presentado en los tribunales de aquel país, causa en la que la defensa de Emtrasur, representada en territorio argentino por el abogado Maximiliano Rusconi, no se presentó.

 DS



Mirá también






Más misterio: el banquero de Putín que viajó a El Calafate denunció por terrorismo al acusado de atentar contra Cristina








La justicia de Estados Unidos ordenó el decomiso definitivo del avión venezolano retenido en Ezeiza



";https://www.clarin.com/politica/justicia-argentina-dio-visto-avion-venezolano-irani-retenido-ezeiza-decomisado-unidos_0_AxdoehvucN.html
"
Video: así fue el brutal choque contra el peaje de la Panamericana en el que murió el conductor
";Policiales;"
Un automovilista de 75 años murió en la madrugada del domingo luego de impactar a toda velocidad contra una de las cabinas del peaje del ramal Campana de la Autopista Panamericana, en un violento accidente que causó conmoción por el daño que sufrió el vehículo. 



Piezas del motor desperdigadas por la traza del pavimento, los fierros retorcidos del automóvil tumbados contra una de las cabinas de acceso. Este lunes, se conoció una de las cámaras de seguridad del peaje que mostró el accidente.
Según el registro fílmico de la concesionaria Autopistas del Sol (Ausol), unas luces se acercan al peaje, que tenía un cono en el medio. No estaba habilitado para el paso, pero no se vislumbra si intenta esquivarlo. Allí muerde contra el parachoques que divide los pasos y causa una pequeña explosión.
El auto, que venía a toda velocidad, sale disparado y se incrustó contra la cabina 7 del peaje, luego de volcar en el acceso a la zona de cobro. Para esa altura era una pelota de fuego, que dejaba a su paso pedazos de la carrocería. 
Todavía se está investigando el motivo del accidente, aunque las imágenes dan cuenta de la brutalidad del golpe.
El accidente se produjo a la altura del kilómetro 33,5, en el peaje del Ramal Campana que va rumbo a la Ciudad de Buenos Aires.
De acuerdo a las filmaciones que se viralizaron de la zona del choque, el auto quedó con las ruedas para arriba, doblado por la mitad. A su alrededor, piezas del motor y de la carrocería. Tal fue la violencia del impacto, que los investigadores tardaron en identificar marca y modelo del vehículo, un Volkswagen CC Passat color gris. 
El video también registra a dos trabajadores del peaje que logran salir por su propios medios de una de las cabinas. Desde Ausol indicaron que los mismos ""no sufrieron consecuencias”. Por el choque, las cabinas de peajes 6,7 y 8 permanecen cerradas. 
Panamericana: un camión derribó un puente peatonal
Un puente peatonal cayó esta mañana tras ser embestido por un camión y provocó un corte total de tránsito en el ramal Pilar de la autopista Panamericana, a la altura de la localidad de Fátima, en el partido bonaerense de Pilar.
 El hecho ocurrió cerca de las 7.30 en el kilometro 62,500 de la autopista Panamericana, donde el conductor de un camión volcador de una empresa vial no percató que llevaba el sistema de batea elevado y embistió la parte superior de un puente peatonal.
Como resultado del impacto, parte de la pasarela cayó en la zona trasera de una camioneta que en ese momento circulaba detrás del camión en sentido a Provincia.
 El conductor del camión sufrió unas heridas leves, mientras que el de la camioneta salió ileso según informaron fuentes policiales.
La autopista se encontraba totalmente cerrada al tránsito en ambos sentidos ya que parte del puente quedó caído en un sentido y en otro quedó suspendido.
Al momento del colapso no había nadie pasando por arriba del puente, aunque los testigos indicaron que una señora con un hijo se encontraban bajando por la escalera. Se salvaron por apenas un minuto. El próximo puente peatonal más cercano se encuentra a tres cuadras.
 Poco antes del mediodía los operadores ya habían terminado de levantar los escombros que cayeron sobre la traza de la autopista. El camión y el auto ya fueron retirados, mientras que en el lugar solo quedó la batea que impactó contra el puente.



Mirá también






Caos de tránsito en la Panamericana: un camión derribó un puente peatonal y está cortado el ramal Pilar








Choque y vuelco en la Panamericana: un hombre murió tras impactar contra la cabina del peaje



";https://www.clarin.com/sociedad/video-brutal-choque-peaje-panamericana-murio-conductor_0_C2jXdq0GG0.html
"
El creador de ChatGPT anuncia el fin de la era del teletrabajo: ""Fue un error y está terminada""
";Tecnología;"
El CEO de OpenAI, Sam Altman, cuya plataforma ChatGPT amenaza con acabar con millones de empleos y varias profesiones tradicionales, no tuvo reparos en atacar una de las formas de trabajo que se instauró con la pandemia de Covid-19: el home office. 



 El cerebro detrás de la mayor empresa actual de inteligencia artificial, que desarrolló ChatGPT y DALL-E, fue categórico a la hora de dar su opinión sobre el teletrabajo durante una reciente conferencia organizada por la fintech Stripe: ""No es una buena opción para las nuevas empresas"".
Y comentó: ""Creo que definitivamente es uno de los peores errores de la industria tecnológica en un mucho tiempo fue que todo el mundo (pensaba que) podía ir de lleno a lo remoto para siempre"".
El teletrabajo, también conocido como trabajo remoto o trabajo a distancia, es una modalidad laboral en la cual los empleados realizan sus tareas desde su hogar u otro lugar fuera de la oficina tradicional. Esta modalidad se potenció en los últimos años debido a los avances tecnológicos y la creciente conectividad; sin embargo, Sam Altman no cree que esta modalidad no debería mantenerse en el tiempo.









Altman es CEO de OpenAI, la compañía detrás de ChatGPT. (Foto: Reuters) 


“Yo diría que el experimento sobre el teletrabajo terminó, y la tecnología aún no es lo suficientemente buena como para que las personas puedan estar llenas remoto para siempre, particularmente en las nuevas empresas"", agregó el CEO.
Altman también señaló que crear nuevos productos es más fácil mientras los empleados trabajaban habitualmente en un mismo espacio de oficina, pero trabajar desde casa considera que solo aumenta la confusión.
La supervisión y el control limitado, los desafíos a la hora de evaluar el desempeño de los empleados y la poca inversión en infraestructura y tecnología para potenciar el teletrabajo son las principales contradicciones que suelen argumentar las empresas sobre el trabajo remoto.
Asimismo, muchas empresas de tecnología de todo el mundo y sus líderes expresaron su preocupación por las condiciones prolongadas del teletrabajo mencionando la falta de creatividad, problemas de formación de equipos y retrasos en los resultados de los proyectos.
 Esta no es la primera vez que Altman aprovecha para criticar el trabajo fuera de la oficina. En enero, respondió en una entrevista diciendo OpenAI tiene algunas personas trabajando de forma remota, pero principalmente en persona.
""En mi opinión, la mayoría de las empresas de tecnología que se apresuraron a usar el teletrabajo completo y de forma permanentemente cometió un gran error, y las grietas son empezando a mostrar"", reflexionó Altman.
La Casa Blanca busca limitar a los gigantes de la IA









ChatGPT fue señalada por la Casa Blanca. Foto: REUTERS. 


Por otro lado, Sam Altman y sus pares de las principales compañías desarrolladoras de plataformas de inteligencia artificial generativa (IAG) fueron señaladas por las autoridades de la Casa Blanca quien llamó a que protejan a la sociedad de los peligros potenciales de sus tecnologías al tiempo que estudia nuevas regulaciones para el sector.
La vicepresidenta Kamala Harris convocó a los directivos de Google, Microsoft, OpenAi y Anthropic para trazar estrategias sobre el impacto de la IA, ante temores de que la industria avance a ciegas en esta tecnología con potenciales riesgos para la sociedad.
""El sector privado tiene el deber ético, moral y legal de asegurarse de la seguridad de sus productos"", indicó Harris en un comunicado tras reunirse con Satya Nadella (Microsoft), Sundar Pichai (Google), Sam Altman (OpenAI) y Dario Amodei (Anthropic) y varios miembros del gobierno.
Harris señaló que la IA tiene el ""potencial de mejorar la vida cotidiana y abordar algunos de los mayores desafíos de la sociedad"", pero también podría ""aumentar drásticamente las amenazas a la seguridad, reducir los derechos humanos y la privacidad y socavar la confianza pública en la democracia"".
Por su parte -al intervenir brevemente en la reunión-, el presidente Joe Biden advirtió a los empresarios del ""enorme potencial y enorme peligro en lo que ustedes hacen"".
""Sé que ustedes lo entienden y espero que puedan informarnos de lo que consideren que es más necesario para proteger a la sociedad, así como para su avance"", agregó el mandatario.
Biden ha insistido al Congreso para fijar leyes con límites más estrictos en el sector tecnológico, aunque estos esfuerzos tienen pocas posibilidades debido a las divisiones políticas.
La falta de regulación le permitió a las empresas con sede en Silicon Valley la libertad de lanzar nuevos productos rápidamente y esto alimentó temores que que la IA pueda causar estragos en la sociedad antes de que el gobierno se ponga al día en este tema.
SL



Mirá también






El ""ChatGPT de las contraseñas"" que puede descifrar cualquier combinación en menos de un minuto








Samsung prohíbe el uso interno de ChatGPT y hasta amenaza con despidos



";https://www.clarin.com/tecnologia/creador-chatgpt-anuncia-fin-teletrabajo-error-terminada-_0_2BftCWJViN.html
